Product ID|Active (0/1)|Name *|Categories (x,y,z...)|Price|Макс скидка|Налог ID|Оптовая цена|Распродажа (0/1)|Величина скидки|Процент скидки|Скидка с (yyyy-mm-dd)|Скидка по (yyyy-mm-dd)|Артикул|Артикул поставщика|Поставщик|Производитель|R1|R2|R3|Годен до|Срок годности|Штрих EAN13|Штрих EAN13|Штрих EAN13|Штрих UPC|Экол. налог|Ширина|Высота|Глубина|Вес|Кол-во|Мин. кол-во|Видимость|Доп расходы доставка|Ед. изм|Ед. изм Пост|К-нт передачи|Текст фасовки|Страна происх.|Сертификат|Сертификат полный|ГТД|Ед. изм 2|Цена|Короткое описание|Описание|Метки (x,y,z...)|Meta title|Meta keywords|Meta description|URL rewritten|Текст в наличии|Текст на заказ|Доступен (0/1)|Дата доступен|Дата создания|Отображать цену (0/1)|URL фото (x,y,z...)|Удалить фото (0/1)|Характеристика (Name:Value:Position)|Доступен только онлайн (0/1)|Состояние|Настраиваемый (0 = No, 1 = Yes)|Загружаемые файлы (0 = No, 1 = Yes)|Текстовые поля (0 = No, 1 = Yes)|Действия когда нет в наличии|ID магазина|Расширенное управление (0 = No, 1 = Yes)|Количество (0 = Страница, 1 = Склад)|Склад ID
751|1|Бубль-гум (0,8"х 25) АКЦИЯ МОНОБЛОК|9^63^71^76^85^86^107^114^117|752.00|100|0|413.60||||||Р7300|Р7300|1|1|1|1|18|01-21|3||||||12.500000|11.800000|14.500000|1.277778||1|||0|0|1|за 1 шт.|1|ЩШ01.А.00008        |ЩШ01.А.00008 0464024 ООО "ИЦ "ПИРОТЕСТ" ООО "Русский фейерверк" RP-01/16 от 02.02.2016 29.11.2016-28.11.2019                                                                                                                                              |10130080/180517/0011277  |||5 эффектов:<BR><BR>1. Красные звезды с пышными хвостами (кокос) и белое мерцание.<BR><BR>2. Зеленая сфера (пион) и белое мерцание.<BR><BR>3. Желтая сфера (пион) и белое мерцание.<BR><BR>4. Синяя сфера (пион) и белое мерцание.<BR><BR>5. Красное мерцание и облако трещащих разрывов (трещащий дождь).|5 эффектов:<BR><BR>1. Красные звезды с пышными хвостами (кокос) и белое мерцание.<BR><BR>2. Зеленая сфера (пион) и белое мерцание.<BR><BR>3. Желтая сфера (пион) и белое мерцание.<BR><BR>4. Синяя сфера (пион) и белое мерцание.<BR><BR>5. Красное мерцание и облако трещащих разрывов (трещащий дождь).<br><BR><iframe width="560" height="315" src="https://www.youtube.com/embed/4O_9xeCsymg?rel=0" frameborder="0" allowfullscreen></iframe>||Батареи салютов Бубль-гум (0,8"х 25) АКЦИЯ МОНОБЛОК Р7300 ОПТОМ                                                                                                                                                                                               |                                                                                                                                                                                                                                                              |У нас Вы можете купить Батареи салютов Бубль-гум (0,8"х 25) АКЦИЯ МОНОБЛОК Р7300 ОПТОМ по самым низким ценам!                                                                                                                                                 ||||1|||1|http://cx14726.tmweb.ru/images/р7300.jpg^http://cx14726.tmweb.ru/images/р7300-1.jpg^http://cx14726.tmweb.ru/images/р7300-2.jpg^http://cx14726.tmweb.ru/images/р7300-3.jpg|1|Количество залпов:25:1^Калибр, дюйм:0.8:2^Высота, м.:40:3^Время, сек.:40:4||new||||2|1^9|1|1|
752|1|Жар-птица (0,8"х 25) МОНОБЛОК 5 эфф|9^63^107^114^117|830.00|100|0|456.50||||||Р7302|Р7302|1|1|1|1|16|01-21|3||||||0.000000|0.000000|0.000000|1.187500||1|||0|0|1|за 1 шт.|1|ЩШ01.А.0029         |ЩШ01.А.0029 0464047 ООО "ИЦ "ПИРОТЕСТ" ООО "Русский фейерверк" RR-01/17 от 17.01.2017 12.09.2017-11.09.2020                                                                                                                                               |10130080/180517/0011277  ||||<br><BR>||Батареи салютов Жар-птица (0,8"х 25) МОНОБЛОК 5 эфф Р7302 ОПТОМ                                                                                                                                                                                               |                                                                                                                                                                                                                                                              |У нас Вы можете купить Батареи салютов Жар-птица (0,8"х 25) МОНОБЛОК 5 эфф Р7302 ОПТОМ по самым низким ценам!                                                                                                                                                 ||||1|||1|http://cx14726.tmweb.ru/images/р7302.jpg|1|Количество залпов:25:1^Калибр, дюйм:0.8:2^Время, сек.:0:4||new||||2|1^9|1|1|
753|1|Сорвиголова (0,8"х 25)|9^63^71^84^85^86^107^114^117|956.00|100|0|525.80||||||Р7311|Р7311|1|1|1|1|24|01-21|3||||||13.000000|12.000000|12.500000|1.083333||1|||0|0|1|за 1 шт.|1|ЩШ01.А.00028        |ЩШ01.А.00028 046046 ООО "ИЦ "ПИРОТЕСТ" ООО "Русский фейерверк" RR-01/17 от 17.01.2017 12.09.2017-11.09.2020                                                                                                                                               |10130080/180517/0011277  |||1. Белые звезды с белыми хвостами.<BR><BR>2. Оранжевые звезды.<BR><BR>3. Синие звезды с золотыми хвостами и зеленым мерцанием.<BR><BR>4. Красные звезды с треском.<BR><BR>5. Залп серебряных вспышек с оглушительным грохотом.|1. Белые звезды с белыми хвостами.<BR><BR>2. Оранжевые звезды.<BR><BR>3. Синие звезды с золотыми хвостами и зеленым мерцанием.<BR><BR>4. Красные звезды с треском.<BR><BR>5. Залп серебряных вспышек с оглушительным грохотом.<br><BR><iframe width="560" height="315" src="https://www.youtube.com/embed/bQKpZHNbEjQ?rel=0" frameborder="0" allowfullscreen></iframe>||Батареи салютов Сорвиголова (0,8"х 25) Р7311 ОПТОМ                                                                                                                                                                                                            |                                                                                                                                                                                                                                                              |У нас Вы можете купить Батареи салютов Сорвиголова (0,8"х 25) Р7311 ОПТОМ по самым низким ценам!                                                                                                                                                              ||||1|||1|http://cx14726.tmweb.ru/images/р7311.jpg^http://cx14726.tmweb.ru/images/р7311-1.jpg^http://cx14726.tmweb.ru/images/р7311-2.jpg^http://cx14726.tmweb.ru/images/р7311-3.jpg^http://cx14726.tmweb.ru/images/р7311-4.jpg^http://cx14726.tmweb.ru/images/р7311-5.jpg|1|Количество залпов:25:1^Калибр, дюйм:0.8:2^Высота, м.:35:3^Время, сек.:30:4||new||||2|1^9|1|1|
754|1|Лукоморье  (0,8" х 25)|9^63^71^76^85^87^107^114^117|799.00|100|0|439.45||||||Р7312|Р7312|1|1|1|1|18|01-21|3||||||12.500000|12.500000|12.500000|1.111111||1|||0|0|1|за 1 шт.|1|ЩШ01.А.00025        |ЩШ01.А.00025 0464042 ООО "Испытательный центр "ПИРОТЕСТ" ООО "Русский фейерверк" RR-01/17 от 17.01.2017 18.07.2017-17.07.2020                                                                                                                             |10130080/180517/0011277  ||||<br><BR><iframe width="560" height="315" src="https://www.youtube.com/embed/IeSOzHTaI0g?rel=0" frameborder="0" allowfullscreen></iframe>||Батареи салютов Лукоморье  (0,8" х 25) Р7312 ОПТОМ                                                                                                                                                                                                            |                                                                                                                                                                                                                                                              |У нас Вы можете купить Батареи салютов Лукоморье  (0,8" х 25) Р7312 ОПТОМ по самым низким ценам!                                                                                                                                                              ||||1|||1|http://cx14726.tmweb.ru/images/р7312.jpg^http://cx14726.tmweb.ru/images/р7312-1.jpg^http://cx14726.tmweb.ru/images/р7312-2.jpg^http://cx14726.tmweb.ru/images/р7312-3.jpg^http://cx14726.tmweb.ru/images/р7312-4.jpg|1|Количество залпов:25:1^Калибр, дюйм:0.8:2^Высота, м.:35:3^Время, сек.:30:4||new||||2|1^9|1|1|
759|1|Балалайка (0,8"х36) АКЦИЯ МОНОБЛОК|9^63^76^107^114^118|1080.00|100|0|594.00||||||Р7321|Р7321|1|1|1|1|12|01-21|3||||||12.500000|13.800000|16.800000|1.166667||1|||0|0|1|за 1 шт.|1|ЩШ01.А.00008        |ЩШ01.А.00008 0464024 ООО "ИЦ "ПИРОТЕСТ" ООО "Русский фейерверк" RP-01/16 от 02.02.2016 29.11.2016-28.11.2019                                                                                                                                              |10130080/180517/0011277  |||5 эффектов:<BR><BR>1.Множество серебряных ниспадающих нитей (парча) и красное мерцание.<BR><BR>2.Множество серебряных ниспадающих нитей (парча) и зеленое мерцание.<BR><BR>3.Множество серебряных ниспадающих нитей (парча) и золотое мерцание.<BR><BR>4.Множество серебряных ниспадающих нитей (парча) и белое мерцание.<BR><BR>5. Облако трещащих разрывов (трещащая хризантема).|5 эффектов:<BR><BR>1.Множество серебряных ниспадающих нитей (парча) и красное мерцание.<BR><BR>2.Множество серебряных ниспадающих нитей (парча) и зеленое мерцание.<BR><BR>3.Множество серебряных ниспадающих нитей (парча) и золотое мерцание.<BR><BR>4.Множество серебряных ниспадающих нитей (парча) и белое мерцание.<BR><BR>5. Облако трещащих разрывов (трещащая хризантема).<br><BR><iframe width="560" height="315" src="https://www.youtube.com/embed/Ddn0Uu3D8cs?rel=0" frameborder="0" allowfullscreen></iframe>||Батареи салютов Балалайка (0,8"х36) АКЦИЯ МОНОБЛОК Р7321 ОПТОМ                                                                                                                                                                                                |                                                                                                                                                                                                                                                              |У нас Вы можете купить Батареи салютов Балалайка (0,8"х36) АКЦИЯ МОНОБЛОК Р7321 ОПТОМ по самым низким ценам!                                                                                                                                                  ||||1|||1|http://cx14726.tmweb.ru/images/р7321.jpg^http://cx14726.tmweb.ru/images/р7321-1.jpg^http://cx14726.tmweb.ru/images/р7321-2.jpg^http://cx14726.tmweb.ru/images/р7321-3.jpg^http://cx14726.tmweb.ru/images/р7321-4.jpg^http://cx14726.tmweb.ru/images/р7321-5.jpg|1|Количество залпов:36:1^Калибр, дюйм:0.8:2^Высота, м.:35:3^Время, сек.:70:4||new||||2|1^9|1|1|
762|1|Пламенный привет (0,8"х 49) АКЦИЯ МОНОБЛОК|9^63^76^107^114^119|1680.00|100|0|924.00||||||Р7325|Р7325|1|1|1|1|8|01-21|3||||||15.000000|16.000000|19.500000|2.500000||1|||0|0|1|за 1 шт.|1|ЩШ01.А.00008        |ЩШ01.А.00008 0464024 ООО "ИЦ "ПИРОТЕСТ" ООО "Русский фейерверк" RP-01/16 от 02.02.2016 29.11.2016-28.11.2019                                                                                                                                              |10130080/180517/0011277  |||7 эффектов:<BR><BR>1. Множество серебряных ниспадающих нитей (парча) и красное мерцание.<BR><BR>2. Серебряные звезды с хвостами (волна) и зеленое мерцание.<BR><BR>3.Множество серебряных ниспадающих нитей (парча) и золотое мерцание.<BR><BR>4. Серебряные звезды с хвостами (волна) и красная сфера (пион).<BR><BR>5. Серебряные звезды с хвостами (волна) и синяя сфера (пион).<BR><BR>6. Множество серебряных ниспадающих нитей (парча) и зеленое мерцание.<BR><BR>7. Множество серебряных ниспадающих нитей (парча) и облако трещащих разрывов (трещащий дождь).|7 эффектов:<BR><BR>1. Множество серебряных ниспадающих нитей (парча) и красное мерцание.<BR><BR>2. Серебряные звезды с хвостами (волна) и зеленое мерцание.<BR><BR>3.Множество серебряных ниспадающих нитей (парча) и золотое мерцание.<BR><BR>4. Серебряные звезды с хвостами (волна) и красная сфера (пион).<BR><BR>5. Серебряные звезды с хвостами (волна) и синяя сфера (пион).<BR><BR>6. Множество серебряных ниспадающих нитей (парча) и зеленое мерцание.<BR><BR>7. Множество серебряных ниспадающих нитей (парча) и облако трещащих разрывов (трещащий дождь).<br><BR><iframe width="560" height="315" src="https://www.youtube.com/embed/nHQAYfAeJGQ?rel=0" frameborder="0" allowfullscreen></iframe>||Батареи салютов Пламенный привет (0,8"х 49) АКЦИЯ МОНОБЛОК Р7325 ОПТОМ                                                                                                                                                                                        |                                                                                                                                                                                                                                                              |У нас Вы можете купить Батареи салютов Пламенный привет (0,8"х 49) АКЦИЯ МОНОБЛОК Р7325 ОПТОМ по самым низким ценам!                                                                                                                                          ||||1|||1|http://cx14726.tmweb.ru/images/р7325.jpg^http://cx14726.tmweb.ru/images/р7325-1.jpg^http://cx14726.tmweb.ru/images/р7325-2.jpg^http://cx14726.tmweb.ru/images/р7325-3.jpg^http://cx14726.tmweb.ru/images/р7325-4.jpg^http://cx14726.tmweb.ru/images/р7325-5.jpg|1|Количество залпов:49:1^Калибр, дюйм:0.8:2^Высота, м.:35:3^Время, сек.:70:4||new||||2|1^9|1|1|
763|1|Краски жизни (0,8"х 90) НОВЫЙ ЭФФЕКТ|9^63^107^114^121|3400.00|100|0|1870.00||||||Р7326|Р7326|1|1|1|1|4|01-21|3||||||12.000000|22.500000|25.000000|4.000000||1|||0|0|1|за 1 шт.|1|ЩШ01.А.00028        |ЩШ01.А.00028 046046 ООО "ИЦ "ПИРОТЕСТ" ООО "Русский фейерверк" RR-01/17 от 17.01.2017 12.09.2017-11.09.2020                                                                                                                                               |10130080/180517/0011277  |||8 эффектов:<BR><BR>1. Красные звезды с пышными хвостами (кокос) и белое мерцание.<BR><BR>2. Красная сфера (пион) и облако трещащих разрывов (трещащая хризантема).<BR><BR>3. Синяя сфера (пион) и белое мерцание.<BR><BR>4. Красные кометы с белыми хвостами.<BR><BR>5. Свистящие кометы.<BR><BR>6. Трещащие кометы.<BR><BR>7. Множество серебряных ниспадающих нитей (парча) и красные звезды.<BR><BR>8. Красочная концовка: зелено- красная сфера (пион) и треск.|8 эффектов:<BR><BR>1. Красные звезды с пышными хвостами (кокос) и белое мерцание.<BR><BR>2. Красная сфера (пион) и облако трещащих разрывов (трещащая хризантема).<BR><BR>3. Синяя сфера (пион) и белое мерцание.<BR><BR>4. Красные кометы с белыми хвостами.<BR><BR>5. Свистящие кометы.<BR><BR>6. Трещащие кометы.<BR><BR>7. Множество серебряных ниспадающих нитей (парча) и красные звезды.<BR><BR>8. Красочная концовка: зелено- красная сфера (пион) и треск.<br><BR><iframe width="560" height="315" src="https://www.youtube.com/embed/M1_aIN-hwig?rel=0" frameborder="0" allowfullscreen></iframe>||Батареи салютов Краски жизни (0,8"х 90) НОВЫЙ ЭФФЕКТ Р7326 ОПТОМ                                                                                                                                                                                              |                                                                                                                                                                                                                                                              |У нас Вы можете купить Батареи салютов Краски жизни (0,8"х 90) НОВЫЙ ЭФФЕКТ Р7326 ОПТОМ по самым низким ценам!                                                                                                                                                ||||1|||1|http://cx14726.tmweb.ru/images/р7326.jpg^http://cx14726.tmweb.ru/images/р7326-1.jpg^http://cx14726.tmweb.ru/images/р7326-2.jpg^http://cx14726.tmweb.ru/images/р7326-3.jpg^http://cx14726.tmweb.ru/images/р7326-4.jpg^http://cx14726.tmweb.ru/images/р7326-5.jpg^http://cx14726.tmweb.ru/images/р7326-6.jpg^http://cx14726.tmweb.ru/images/р7326-7.jpg|1|Количество залпов:90:1^Калибр, дюйм:0.8:2^Высота, м.:40:3^Время, сек.:55:4||new||||2|1^9|1|1|
