1124|1|Резервная валюта (фонтан + 12 залпов салюта)|6^45|856.00|100|0|470.80||||||РС170|РС170|1|3|1|1|24|04-21|3||||||14.600000|0.000000|17.500000|1.041667||1|||0|0|1|за 1 шт.|1|ЦЦ09.А.00665        |ЦЦ09.А.00665 0159032 ООО "Пуск" АО "ФНПЦ "НИИПХ" RP-02/17 от 08.02.2017 17.07.2017-16.07.2020                                                                                                                                                             |10130080/230617/0014265  |||Красное пламя и поток серебряных искр.<BR>Поток трещащих искр, красных и зеленых огней.<BR>Золотые форсы и синие огни.<BR>Красные огни и множество трещащих сфер.<BR>Зеленые огни с серебряными форсами и серебряные мерцающие огни.<BR>Золотые форсы и множество трещащих мерцающих огней (залп).|Красное пламя и поток серебряных искр.<BR>Поток трещащих искр, красных и зеленых огней.<BR>Золотые форсы и синие огни.<BR>Красные огни и множество трещащих сфер.<BR>Зеленые огни с серебряными форсами и серебряные мерцающие огни.<BR>Золотые форсы и множество трещащих мерцающих огней (залп).<br><BR><iframe width="560" height="315" src="https://youtu.be/abKvTGVzeO8?rel=0" frameborder="0" allowfullscreen></iframe>||Резервная валюта (фонтан + 12 залпов салюта) РС170 ОПТОМ                                                                                                                                                                                                      |                                                                                                                                                                                                                                                              |У нас Вы можете купить Резервная валюта (фонтан + 12 залпов салюта) РС170 ОПТОМ по самым низким ценам!                                                                                                                                                        ||||1|||1|http://cx14726.tmweb.ru/images/рс170.jpg|1|Количество залпов:12:1^Калибр, дюйм:1:2^Высота, м.:35:3^Время, сек.:35:4||new||||2|1^9|1|1|
1125|1|Зашибись (фонтан + 12 залпов салюта)|6|1102.00|100|0|606.10||||||РС171|РС171|1|3|1|1|12|04-21|3||||||17.100000|14.600000|14.600000|1.666667||1|||0|0|1|за 1 шт.|1|ЦЦ09.А.00687        |ЦЦ09.А.00687 0159054 ООО "ПУСК" АО "ФНПЦ "НИИПХ" RR-02/17 от 08.02.2017 22.08.2017-21.08.2020                                                                                                                                                             |10130080/230617/0014265  |||Поток золотых трещащих разлетающихся искр; красных и зеленых огней. 2. Красные огни и швермерные элементы. 3. Зеленые огни и серебряные искристые форсы. 4. Красные огни и множество трещащих сфер.|Поток золотых трещащих разлетающихся искр; красных и зеленых огней. 2. Красные огни и швермерные элементы. 3. Зеленые огни и серебряные искристые форсы. 4. Красные огни и множество трещащих сфер.<br><BR><iframe width="560" height="315" src="https://www.youtube.com/embed/k9bt-UM3QFo?rel=0" frameborder="0" allowfullscreen></iframe>||Зашибись (фонтан + 12 залпов салюта) РС171 ОПТОМ                                                                                                                                                                                                              |                                                                                                                                                                                                                                                              |У нас Вы можете купить Зашибись (фонтан + 12 залпов салюта) РС171 ОПТОМ по самым низким ценам!                                                                                                                                                                ||||1|||1|http://cx14726.tmweb.ru/images/рс171.jpg^http://cx14726.tmweb.ru/images/rc171-1.jpg^http://cx14726.tmweb.ru/images/рс171-1.jpg^http://cx14726.tmweb.ru/images/rc171-2.jpg^http://cx14726.tmweb.ru/images/рс171-2.jpg^http://cx14726.tmweb.ru/images/rc171-3.jpg^http://cx14726.tmweb.ru/images/рс171-3.jpg^http://cx14726.tmweb.ru/images/rc171-4.jpg^http://cx14726.tmweb.ru/images/рс171-4.jpg^http://cx14726.tmweb.ru/images/rc171-5.jpg^http://cx14726.tmweb.ru/images/рс171-5.jpg^http://cx14726.tmweb.ru/images/rc171-6.jpg^http://cx14726.tmweb.ru/images/рс171-6.jpg|1|Количество залпов:12:1^Калибр, дюйм:1:2^Высота, м.:35:3^Время, сек.:30:4||new||||2|1^9|1|1|
1132|1|Ариэль (набор ракет, шесть разных эффектов)|4^38|150.00|100|0|82.50||||||РС220|РС220|1|3|6|1|72|04-21|3||||||40.000000|11.000000|11.000000|0.111111||1|||1|1|1|за 1 уп. из 6 шт.|1|ЦЦ09.А.00704        |ЦЦ09.А.00704 0159071 ООО "ПУСК" АО "ФНПЦ "НИИПХ" RP-02/17 от 08.02.2017 08.09.2017-07.09.2020                                                                                                                                                             |10130080/230617/0014265  |шт.|25.00|6 эффектов. В каждой ракете свой эффект.<BR>1. золотые падающие огоньки.<BR>2. красные падающие огоньки и 2 вспышки.<BR>3. серебряные мерцающие огни.<BR>4. букет из красных огней.<BR>5. букет из желтых огней.<BR>6. букет из зеленых огней.|6 эффектов. В каждой ракете свой эффект.<BR>1. золотые падающие огоньки.<BR>2. красные падающие огоньки и 2 вспышки.<BR>3. серебряные мерцающие огни.<BR>4. букет из красных огней.<BR>5. букет из желтых огней.<BR>6. букет из зеленых огней.<br><BR><iframe width="560" height="315" src="https://www.youtube.com/embed/rNCTslkA6Co?rel=0" frameborder="0" allowfullscreen></iframe>||Ариэль (набор ракет, шесть разных эффектов) РС220 ОПТОМ                                                                                                                                                                                                       |                                                                                                                                                                                                                                                              |У нас Вы можете купить Ариэль (набор ракет, шесть разных эффектов) РС220 ОПТОМ по самым низким ценам!                                                                                                                                                         ||||1|||1|http://cx14726.tmweb.ru/images/рс220.jpg|1|Калибр, дюйм:0.6:2^Высота, м.:40:3^Время, сек.:0:4||new||||2|1^9|1|1|
1133|1|Феникс (набор ракет, шесть разных эффектов)|4^38|690.00|100|0|379.50||||||РС230|РС230|1|3|6|1|24|04-21|3||||||69.100000|4.500000|17.000000|0.500000||1|||1|1|1|за 1 уп. из 6 шт.|1|ЦЦ09.А.00699        |ЦЦ09.А.00699 0159066 ООО "ПУСК" АО "ФНПЦ "НИИПХ" RP-01/17 от 14.02.2017 07.09.2017-06.09.2020                                                                                                                                                             |10130080/200517/0000820  |шт.|115.00|6 ракет: красные или фиолетовые звезды с треском и искристыми форсами; серебристая мерцающая сфера; множество эффектных золотых комет; двухцветные зелено-сиреневые пионы; золотые цветы с белым мерцанием|6 ракет: красные или фиолетовые звезды с треском и искристыми форсами; серебристая мерцающая сфера; множество эффектных золотых комет; двухцветные зелено-сиреневые пионы; золотые цветы с белым мерцанием<br><BR><iframe width="560" height="315" src="https://www.youtube.com/embed/_PPPVbQYaVU?rel=0" frameborder="0" allowfullscreen></iframe>||Феникс (набор ракет, шесть разных эффектов) РС230 ОПТОМ                                                                                                                                                                                                       |                                                                                                                                                                                                                                                              |У нас Вы можете купить Феникс (набор ракет, шесть разных эффектов) РС230 ОПТОМ по самым низким ценам!                                                                                                                                                         ||||1|||1|http://cx14726.tmweb.ru/images/рс230.jpg^http://cx14726.tmweb.ru/images/рс230-1.jpg^http://cx14726.tmweb.ru/images/рс230-2.jpg|1|Калибр, дюйм:1.1:2^Высота, м.:70:3^Время, сек.:0:4||new||||2|1^9|1|1|
1135|1|Сириус (набор ракет, четыре разных эффекта)|4^38|880.00|100|0|484.00||||||РС240|РС240|1|3|4|1|16|04-21|3||||||82.000000|4.100000|18.000000|0.687500||1|||1|1|1|за 1 уп. из 4 шт.|1|ЦЦ09.А.00705        |ЦЦ09.А.00705 0159072 ООО "ПУСК" АО "ФНПЦ "НИИПХ" RP-01/17 от 14.02.2017 08.09.2017-07.09.2020                                                                                                                                                             |10130080/200517/0000820  |шт.|220.00|4 эффекта.  В каждой ракете свой эффект <BR>1. сфера из зеленых и трещащих огней. <BR>2. сфера из красных огней с форсами и белых огней. <BR>3. сфера из золотых форсов с серебряными искрами и красных огней. <BR>4. сфера из синих огней с серебряными рыбками в центре.|4 эффекта.  В каждой ракете свой эффект <BR>1. сфера из зеленых и трещащих огней. <BR>2. сфера из красных огней с форсами и белых огней. <BR>3. сфера из золотых форсов с серебряными искрами и красных огней. <BR>4. сфера из синих огней с серебряными рыбками в центре.<br><BR><iframe width="560" height="315" src="https://www.youtube.com/embed/qaEs_boxmVE?rel=0" frameborder="0" allowfullscreen></iframe>||Сириус (набор ракет, четыре разных эффекта) РС240 ОПТОМ                                                                                                                                                                                                       |                                                                                                                                                                                                                                                              |У нас Вы можете купить Сириус (набор ракет, четыре разных эффекта) РС240 ОПТОМ по самым низким ценам!                                                                                                                                                         ||||1|||1|http://cx14726.tmweb.ru/images/рс240.jpg|1|Калибр, дюйм:1.65:2^Высота, м.:90:3^Время, сек.:0:4||new||||2|1^9|1|1|
1138|1|Андромеда (набор ракет, два разных эффекта)|4^38|2340.00|100|0|1287.00||||||РС250|РС250|1|3|2|1|12|04-18|1||||||15.000000|0.000000|155.000000|1.083333||1|||1|1|1|за 1 уп. из 2 шт.|1|ЦЦ09.А.00443        |ЦЦ09.А.00443 0153798 ООО "Пуск" ОАО "ФНПЦ "НИИ прикладной химии" RP-02/15 от 17.02.2015 25.11.2015-24.11.2018                                                                                                                                             |10130080/020614/0002535  |шт.|1170.00|2 эффекта.<BR>1. сфера из золотых форсов с белыми мерцающими огнями в центре.<BR>2. сфера из золотых трещащих форсов с красными мерцающими огнями в центре.|2 эффекта.<BR>1. сфера из золотых форсов с белыми мерцающими огнями в центре.<BR>2. сфера из золотых трещащих форсов с красными мерцающими огнями в центре.<br><BR><iframe width="560" height="315" src="https://www.youtube.com/embed/6CidAuhcUZU?rel=0" frameborder="0" allowfullscreen></iframe>||Андромеда (набор ракет, два разных эффекта) РС250 ОПТОМ                                                                                                                                                                                                       |                                                                                                                                                                                                                                                              |У нас Вы можете купить Андромеда (набор ракет, два разных эффекта) РС250 ОПТОМ по самым низким ценам!                                                                                                                                                         ||||1|||1|http://cx14726.tmweb.ru/images/рс250.jpg|1|Калибр, дюйм:3:2^Высота, м.:70:3^Время, сек.:0:4||new||||2|1^9|1|1|
1139|1|Сверхновая (складной стабилизатор)|4^49|1474.00|100|0|810.70||||||РС251|РС251|1|3|1|1|24|04-21|3||||||780.000000|40.000000|85.000000|0.583333||1|||0|0|1|за 1 шт.|1|ЦЦ09.А.00687        |ЦЦ09.А.00687 0159054 ООО "ПУСК" АО "ФНПЦ "НИИПХ" RR-02/17 от 08.02.2017 22.08.2017-21.08.2020                                                                                                                                                             |10130080/230617/0014265  |||Кольцо из серебряных форсов, кольцо из серебряных мерцающих огней, красные огни в центре. <BR>Складной стабилизатор|Кольцо из серебряных форсов, кольцо из серебряных мерцающих огней, красные огни в центре. <BR>Складной стабилизатор<br><BR><iframe width="560" height="315" src="https://www.youtube.com/embed/FaFCoycdnl4?rel=0" frameborder="0" allowfullscreen></iframe>||Ракеты Сверхновая (складной стабилизатор) РС251 ОПТОМ                                                                                                                                                                                                         |                                                                                                                                                                                                                                                              |У нас Вы можете купить Ракеты Сверхновая (складной стабилизатор) РС251 ОПТОМ по самым низким ценам!                                                                                                                                                           ||||1|||1|http://cx14726.tmweb.ru/images/рс251.jpg|1|Количество залпов:1:1^Калибр, дюйм:3:2^Высота, м.:100:3^Время, сек.:0:4||new||||2|1^9|1|1|
1144|1|Фонтаны  "Цветной дым"|21^94|271.00|100|0|149.05||||||РС345|РС345|1|3|5|1|72|04-21|3||||||12.000000|7.500000|2.500000|0.062500||1|||1|1|1|за 1 уп. из 5 шт.|1|ЦЦ09.А.00597        |ЦЦ09.А.00597 0157851 ООО "Пуск" АО "ФНПЦ "НИИПХ" RP-01/16 от 22.01.2016 22.12.2016-21.12.2019                                                                                                                                                             |10130080/030517/0011637  |шт.|54.20|Поток цветного дыма (красный, желтый, зеленый, синий, фиолетовый).|Поток цветного дыма (красный, желтый, зеленый, синий, фиолетовый).<br><BR><iframe width="560" height="315" src="https://www.youtube.com/embed/TFZrapnT_9o?rel=0" frameborder="0" allowfullscreen></iframe>||Прочее Фонтаны  "Цветной дым" РС345 ОПТОМ                                                                                                                                                                                                                     |                                                                                                                                                                                                                                                              |У нас Вы можете купить Прочее Фонтаны  "Цветной дым" РС345 ОПТОМ по самым низким ценам!                                                                                                                                                                       ||||1|||1|http://cx14726.tmweb.ru/images/рс345.jpg|1|||new||||2|1^9|1|1|
1146|1|Факел "Цветной дым"|21^37^94|860.00|100|0|473.00||||||РС347|РС347|1|3|4|1|24|04-21|3||||||0.000000|0.000000|0.000000|0.679167||1|||1|1|1|за 1 уп. из 4 шт.|1|ЦЦ09.А.00665        |ЦЦ09.А.00665 0159032 ООО "Пуск" АО "ФНПЦ "НИИПХ" RP-02/17 от 08.02.2017 17.07.2017-16.07.2020                                                                                                                                                             |10130080/030517/0011637  |шт.|215.00|Поток цветного дыма <BR>(2 красных, 1 зеленый, 1 синий).|Поток цветного дыма <BR>(2 красных, 1 зеленый, 1 синий).<br><BR><iframe width="560" height="315" src="https://www.youtube.com/embed/agSiB2lhKxc?rel=0" frameborder="0" allowfullscreen></iframe>||Прочее Факел "Цветной дым" РС347 ОПТОМ                                                                                                                                                                                                                        |                                                                                                                                                                                                                                                              |У нас Вы можете купить Прочее Факел "Цветной дым" РС347 ОПТОМ по самым низким ценам!                                                                                                                                                                          ||||1|||1|http://cx14726.tmweb.ru/images/рс347.jpg|1|||new||||2|1^9|1|1|
1179|1|Коварная Мэри|6|1300.00|100|0|715.00||||||РС455|РС455|1|3|1|1|12|04-21|3||||||0.000000|0.000000|0.000000|1.000000||1|||0|0|1|за 1 шт.|1|ЦЦ09.А.00687        |ЦЦ09.А.00687 0159054 ООО "ПУСК" АО "ФНПЦ "НИИПХ" RR-02/17 от 08.02.2017 22.08.2017-21.08.2020                                                                                                                                                             |10130080/230617/0014265  ||||<br><BR>||Фонтаны Коварная Мэри РС455 ОПТОМ                                                                                                                                                                                                                             |                                                                                                                                                                                                                                                              |У нас Вы можете купить Фонтаны Коварная Мэри РС455 ОПТОМ по самым низким ценам!                                                                                                                                                                               ||||1|||1|http://cx14726.tmweb.ru/images/рс455.jpg|1|||new||||2|1^9|1|1|
1183|1|Боровик (фонтан в форме гриба)|6|590.00|100|0|324.50||||||РС459|РС459|1|3|1|1|12|04-21|3||||||14.200000|9.000000|9.000000|0.750000||1|||0|0|1|за 1 шт.|1|ЦЦ09.А.00447        |ЦЦ09.А.00447 0155537 ООО "Пуск" ОАО "ФНПЦ "НИИ прикладной химии" RP-02/15 от 17.02.2015 03.12.2015-02.12.2018                                                                                                                                             |10130080/230617/0014265  |||Поток золотых звездочек.<BR>Поток красных и трещащих разлетающихся огней.<BR>Поток красных, зеленых и трещащих разлетающихся огней.<BR>Поток серебряных искр.<BR>Поток зеленых и трещащих разлетающихся огней.<BR>Поток зеленых, фиолетовых и трещащих разлетающихся огней.|Поток золотых звездочек.<BR>Поток красных и трещащих разлетающихся огней.<BR>Поток красных, зеленых и трещащих разлетающихся огней.<BR>Поток серебряных искр.<BR>Поток зеленых и трещащих разлетающихся огней.<BR>Поток зеленых, фиолетовых и трещащих разлетающихся огней.<br><BR><iframe width="560" height="315" src="https://www.youtube.com/embed/gpMrvKlJbLM?rel=0" frameborder="0" allowfullscreen></iframe>||Боровик (фонтан в форме гриба) РС459 ОПТОМ                                                                                                                                                                                                                    |                                                                                                                                                                                                                                                              |У нас Вы можете купить Боровик (фонтан в форме гриба) РС459 ОПТОМ по самым низким ценам!                                                                                                                                                                      ||||1|||1|http://cx14726.tmweb.ru/images/рс459.jpg^http://cx14726.tmweb.ru/images/рс459--3.jpg^http://cx14726.tmweb.ru/images/рс459-1.jpg^http://cx14726.tmweb.ru/images/рс459-2.jpg^http://cx14726.tmweb.ru/images/рс459-4.jpg^http://cx14726.tmweb.ru/images/рс459-5.jpg|1|Высота, м.:7:3||new||||2|1^9|1|1|
