828|1|Севастополь (1,0"х 150)|9^65^71^73^79^107^114^123|10260.00|100|0|5643.00||||||Р7545|Р7545|1|1|1|1|1|01-21|3||||||45.000000|17.500000|30.000000|13.000000||1|||0|0|1|за 1 шт.|1|ЩШ01.А.00026        |ЩШ01.А.00026 0464043 ООО "Испытательный центр "ПИРОТЕСТ" ООО "Русский фейерверк" RR-01/17 от 17.01.2017 11.08.2017-10.08.2020                                                                                                                             |10130080/180517/0011277  |||1. Красные, синие звезды и белое мерцание.<BR><BR>2. Красные звезды с белыми хвостами и треском.<BR><BR>3. Красные звезды с золотыми хвостами.<BR><BR>4. Синие, зеленые звезды и белое мерцание.<BR><BR>5. Зеленые звезды и золотые хвосты.<BR><BR>6. Синие, фиолетовые звезды и белое мерцание.<BR><BR>7. Малиновые звезды с золотыми хвостами и белое мерцание.<BR><BR>8. Синие, оранжевые звезды с белыми хвостами и мерцанием.<BR><BR>9. Лимонные звезды с белыми хвостами и треском.<BR><BR>10. Белые кометы и золотые хвосты.<BR><BR>11. Сфера белого мерцания и трещащих искр.<BR><BR>12. Белые кометы, облако трещащих разрывов и белое мерцание.<BR><BR>13. Синие звезды и золотые хвосты.|1. Красные, синие звезды и белое мерцание.<BR><BR>2. Красные звезды с белыми хвостами и треском.<BR><BR>3. Красные звезды с золотыми хвостами.<BR><BR>4. Синие, зеленые звезды и белое мерцание.<BR><BR>5. Зеленые звезды и золотые хвосты.<BR><BR>6. Синие, фиолетовые звезды и белое мерцание.<BR><BR>7. Малиновые звезды с золотыми хвостами и белое мерцание.<BR><BR>8. Синие, оранжевые звезды с белыми хвостами и мерцанием.<BR><BR>9. Лимонные звезды с белыми хвостами и треском.<BR><BR>10. Белые кометы и золотые хвосты.<BR><BR>11. Сфера белого мерцания и трещащих искр.<BR><BR>12. Белые кометы, облако трещащих разрывов и белое мерцание.<BR><BR>13. Синие звезды и золотые хвосты.<br><BR><iframe width="560" height="315" src="https://www.youtube.com/embed/unwnLfGHkEg?rel=0" frameborder="0" allowfullscreen></iframe>||Батареи салютов Севастополь (1,0"х 150) Р7545 ОПТОМ                                                                                                                                                                                                           |                                                                                                                                                                                                                                                              |У нас Вы можете купить Батареи салютов Севастополь (1,0"х 150) Р7545 ОПТОМ по самым низким ценам!                                                                                                                                                             ||||1|||1|http://cx14726.tmweb.ru/images/р7545.jpg^http://cx14726.tmweb.ru/images/р7545-1.jpg^http://cx14726.tmweb.ru/images/р7545-2.jpg^http://cx14726.tmweb.ru/images/р7545-3.jpg^http://cx14726.tmweb.ru/images/р7545-4.jpg^http://cx14726.tmweb.ru/images/р7545-5.jpg^http://cx14726.tmweb.ru/images/р7545-6.jpg^http://cx14726.tmweb.ru/images/р7545-7.jpg^http://cx14726.tmweb.ru/images/р7545-8.jpg|1|Количество залпов:150:1^Калибр, дюйм:1:2^Высота, м.:45:3^Время, сек.:70:4||new||||2|1^9|1|1|
830|1|Бой курантов (1,25"х 12)|9^64^71^78^107^114^116|1176.00|100|0|646.80||||||Р7547|Р7547|1|1|1|1|12|01-21|3||||||17.500000|11.000000|14.800000|1.666667||1|||0|0|1|за 1 шт.|1|СЗ25.А.00030        |СЗ25.А.00030 0155670 ООО "Северо-Западная НПЛ" ООО "Русский фейерверк" RR-01/16 от 02.02.2016 28.09.2016-27.09.2019                                                                                                                                       |10130080/180517/0011277  |||1. Залп разрывается: красными звездами, переходящими в зеленое мерцание.<BR><BR>2. Синими звездами с белым мерцанием.<BR><BR>3. Фиолетовыми звездами с белыми хвостами и треском.|1. Залп разрывается: красными звездами, переходящими в зеленое мерцание.<BR><BR>2. Синими звездами с белым мерцанием.<BR><BR>3. Фиолетовыми звездами с белыми хвостами и треском.<br><BR><iframe width="560" height="315" src="https://www.youtube.com/embed/T_xh0KZ0eFI?rel=0" frameborder="0" allowfullscreen></iframe>||Батареи салютов Бой курантов (1,25"х 12) Р7547 ОПТОМ                                                                                                                                                                                                          |                                                                                                                                                                                                                                                              |У нас Вы можете купить Батареи салютов Бой курантов (1,25"х 12) Р7547 ОПТОМ по самым низким ценам!                                                                                                                                                            ||||1|||1|http://cx14726.tmweb.ru/images/р7547.jpg^http://cx14726.tmweb.ru/images/р7547-1.jpg^http://cx14726.tmweb.ru/images/р7547-2.jpg^http://cx14726.tmweb.ru/images/р7547-3.jpg^http://cx14726.tmweb.ru/images/р7547-4.jpg|1|Количество залпов:12:1^Калибр, дюйм:1.2:2^Высота, м.:50:3^Время, сек.:25:4||new||||2|1^9|1|1|
834|1|Барабанщица (1,25"х 16) МОНОБЛОК|9^66^76^107^114^116|1030.00|100|0|566.50||||||Р7556|Р7556|1|1|1|1|12|01-21|3||||||17.500000|13.000000|13.000000|1.416667||1|||0|0|1|за 1 шт.|1|ЩШ01.А.00027        |ЩШ01.А.00027 0464045 ООО "Испытательный центр "ПИРОТЕСТ" ООО "Русский фейерверк" RR-01/17 от 17.01.2017 22.08.2017-21.08.2020                                                                                                                             |10130080/180517/0011277  |||4 эффекта:<BR><BR>1. Красные звезды с пышными хвостами (кокос) и зеленые звезды.<BR><BR>2. Лимонно-золотая мерцающая сфера (пион).<BR><BR>3. Зеленые звезды с пышными хвостами (кокос) и треск.<BR><BR>4. Мерцающие золотые хвосты (ива) и красные звезды.|4 эффекта:<BR><BR>1. Красные звезды с пышными хвостами (кокос) и зеленые звезды.<BR><BR>2. Лимонно-золотая мерцающая сфера (пион).<BR><BR>3. Зеленые звезды с пышными хвостами (кокос) и треск.<BR><BR>4. Мерцающие золотые хвосты (ива) и красные звезды.<br><BR><iframe width="560" height="315" src="https://www.youtube.com/embed/otQdF1-v2Vk?rel=0" frameborder="0" allowfullscreen></iframe>||Батареи салютов Барабанщица (1,25"х 16) МОНОБЛОК Р7556 ОПТОМ                                                                                                                                                                                                  |                                                                                                                                                                                                                                                              |У нас Вы можете купить Батареи салютов Барабанщица (1,25"х 16) МОНОБЛОК Р7556 ОПТОМ по самым низким ценам!                                                                                                                                                    ||||1|||1|http://cx14726.tmweb.ru/images/р7556.jpg^http://cx14726.tmweb.ru/images/р7556-1.jpg^http://cx14726.tmweb.ru/images/р7556-2.jpg^http://cx14726.tmweb.ru/images/р7556-3.jpg^http://cx14726.tmweb.ru/images/р7556-4.jpg|1|Количество залпов:16:1^Калибр, дюйм:1.25:2^Высота, м.:50:3^Время, сек.:30:4||new||||2|1^9|1|1|
838|1|С Новым годом! (1,25"х 19)|9^64^71^73^76^78^107^114^116|1599.00|100|0|879.45||||||Р7564|Р7564|1|1|1|1|6|01-21|3||||||22.000000|17.000000|19.000000|3.833333||1|||0|0|1|за 1 шт.|1|ЩШ01.А.00027        |ЩШ01.А.00027 0464045 ООО "Испытательный центр "ПИРОТЕСТ" ООО "Русский фейерверк" RR-01/17 от 17.01.2017 22.08.2017-21.08.2020                                                                                                                             |10130080/180517/0011277  |||4 эффекта:<BR><BR>1. Сфера золотых хвостов с переходом в красные звезды (красная хризантема) и зеленое мерцание.<BR><BR>2. Зеленая сфера (пион), множество золотых ниспадающих нитей (парча) и красное мерцание.<BR><BR>3. Множество серебряных ниспадающих нитей (парча) и синие звезды.<BR><BR>4. Красочная концовка. ЗАЛП: Красная сфера (пион) и облако трещащих разрывов (трещащий дождь).|4 эффекта:<BR><BR>1. Сфера золотых хвостов с переходом в красные звезды (красная хризантема) и зеленое мерцание.<BR><BR>2. Зеленая сфера (пион), множество золотых ниспадающих нитей (парча) и красное мерцание.<BR><BR>3. Множество серебряных ниспадающих нитей (парча) и синие звезды.<BR><BR>4. Красочная концовка. ЗАЛП: Красная сфера (пион) и облако трещащих разрывов (трещащий дождь).<br><BR><iframe width="560" height="315" src="https://www.youtube.com/embed/3qV6YFz_iQo?rel=0" frameborder="0" allowfullscreen></iframe>||Батареи салютов С Новым годом! (1,25"х 19) Р7564 ОПТОМ                                                                                                                                                                                                        |                                                                                                                                                                                                                                                              |У нас Вы можете купить Батареи салютов С Новым годом! (1,25"х 19) Р7564 ОПТОМ по самым низким ценам!                                                                                                                                                          ||||1|||1|http://cx14726.tmweb.ru/images/р7564.jpg^http://cx14726.tmweb.ru/images/р7564-1.jpg^http://cx14726.tmweb.ru/images/р7564-2.jpg^http://cx14726.tmweb.ru/images/р7564-3.jpg^http://cx14726.tmweb.ru/images/р7564-4.jpg^http://cx14726.tmweb.ru/images/р7564-5.jpg|1|Количество залпов:19:1^Калибр, дюйм:1.2:2^Высота, м.:55:3^Время, сек.:30:4||new||||2|1^9|1|1|
844|1|С Рождеством! (1,25"х 19) МОНОБЛОК|9^66^71^76^107^109^114^116|1216.00|100|0|668.80||||||Р7591|Р7591|1|1|1|1|8|01-21|3||||||17.500000|9.000000|18.000000|2.000000||1|||0|0|1|за 1 шт.|1|ЩШ01.А.00027        |ЩШ01.А.00027 0464045 ООО "Испытательный центр "ПИРОТЕСТ" ООО "Русский фейерверк" RR-01/17 от 17.01.2017 22.08.2017-21.08.2020                                                                                                                             |10130080/180517/0011277  |||4 эффекта:<BR><BR>1. Сине-красная сфера (пион).<BR><BR>2. Серебряные звезды с пышными хвостами (кокос) и зеленое мерцание.<BR><BR>3. Золотая комета разрывается множеством золотых ниспадающих нитей (парча) и синей сферой (пион).<BR><BR>4. Красные звезды с пышными хвостами (кокос) и белое мерцание.|4 эффекта:<BR><BR>1. Сине-красная сфера (пион).<BR><BR>2. Серебряные звезды с пышными хвостами (кокос) и зеленое мерцание.<BR><BR>3. Золотая комета разрывается множеством золотых ниспадающих нитей (парча) и синей сферой (пион).<BR><BR>4. Красные звезды с пышными хвостами (кокос) и белое мерцание.<br><BR><iframe width="560" height="315" src="https://www.youtube.com/embed/fTb6STwfTok?rel=0" frameborder="0" allowfullscreen></iframe>||Батареи салютов С Рождеством! (1,25"х 19) МОНОБЛОК Р7591 ОПТОМ                                                                                                                                                                                                |                                                                                                                                                                                                                                                              |У нас Вы можете купить Батареи салютов С Рождеством! (1,25"х 19) МОНОБЛОК Р7591 ОПТОМ по самым низким ценам!                                                                                                                                                  ||||1|||1|http://cx14726.tmweb.ru/images/р7591.jpg^http://cx14726.tmweb.ru/images/р7591-1.jpg^http://cx14726.tmweb.ru/images/р7591-2.jpg^http://cx14726.tmweb.ru/images/р7591-3.jpg^http://cx14726.tmweb.ru/images/р7591-4.jpg|1|Количество залпов:19:1^Калибр, дюйм:1.25:2^Высота, м.:45:3^Время, сек.:35:4||new||||2|1^9|1|1|
845|1|Калаш (1,25"х 19) МОНОБЛОК|9^66^71^73^79^107^114^116|1216.00|100|0|668.80||||||Р7592|Р7592|1|1|1|1|8|01-21|3||||||17.500000|9.000000|18.000000|3.500000||1|||0|0|1|за 1 шт.|1|ЩШ01.А.00027        |ЩШ01.А.00027 0464045 ООО "Испытательный центр "ПИРОТЕСТ" ООО "Русский фейерверк" RR-01/17 от 17.01.2017 22.08.2017-21.08.2020                                                                                                                             |10130080/180517/0011277  |||5 эффектов:<BR><BR>1. Желтые звезды с пышными хвостами (кокос) и золотое мерцание.<BR><BR>2. Синяя сфера (пион) и золотое мерцание.<BR><BR>3. Зеленые звезды с пышными хвостами (кокос) и облако трещащих разрывов (трещащий дождь).<BR><BR>4. Красно-зеленая сфера (пион) и белое мерцание.<BR><BR>5. Красочная концовка. ЗАЛП: Трещащая комета разрывается звездами с пышными трещащими хвостами (трещащий кокос) и облаком трещащих разрывов (трещащая хризантема).|5 эффектов:<BR><BR>1. Желтые звезды с пышными хвостами (кокос) и золотое мерцание.<BR><BR>2. Синяя сфера (пион) и золотое мерцание.<BR><BR>3. Зеленые звезды с пышными хвостами (кокос) и облако трещащих разрывов (трещащий дождь).<BR><BR>4. Красно-зеленая сфера (пион) и белое мерцание.<BR><BR>5. Красочная концовка. ЗАЛП: Трещащая комета разрывается звездами с пышными трещащими хвостами (трещащий кокос) и облаком трещащих разрывов (трещащая хризантема).<br><BR><iframe width="560" height="315" src="https://www.youtube.com/embed/Dt2Z2VCvjTk?rel=0" frameborder="0" allowfullscreen></iframe>||Батареи салютов Калаш (1,25"х 19) МОНОБЛОК Р7592 ОПТОМ                                                                                                                                                                                                        |                                                                                                                                                                                                                                                              |У нас Вы можете купить Батареи салютов Калаш (1,25"х 19) МОНОБЛОК Р7592 ОПТОМ по самым низким ценам!                                                                                                                                                          ||||1|||1|http://cx14726.tmweb.ru/images/р7592.jpg^http://cx14726.tmweb.ru/images/р7592-1.jpg^http://cx14726.tmweb.ru/images/р7592-2.jpg^http://cx14726.tmweb.ru/images/р7592-3.jpg^http://cx14726.tmweb.ru/images/р7592-4.jpg^http://cx14726.tmweb.ru/images/р7592-5.jpg|1|Количество залпов:19:1^Калибр, дюйм:1.25:2^Высота, м.:45:3^Время, сек.:35:4||new||||2|1^9|1|1|
846|1|У Дачи (1,25"х 19) МОНОБЛОК|9^66^76^107^114^116|1216.00|100|0|668.80||||||Р7593|Р7593|1|1|1|1|8|01-21|3||||||17.500000|9.000000|18.000000|2.000000||1|||0|0|1|за 1 шт.|1|ЩШ01.А.00027        |ЩШ01.А.00027 0464045 ООО "Испытательный центр "ПИРОТЕСТ" ООО "Русский фейерверк" RR-01/17 от 17.01.2017 22.08.2017-21.08.2020                                                                                                                             |10130080/180517/0011277  |||5 эффектов:<BR><BR>1. Зеленые звезды с пышными хвостами (кокос) и зеленое мерцание.<BR><BR>2. Фиолетовые звезды с пышными хвостами (кокос) и зеленое мерцание.<BR><BR>3. Фиолетово-желтая сфера (пион) и белое мерцание.<BR><BR>4. Красные звезды с пышными хвостами (кокос) и зеленая сфера (пион).<BR><BR>5. Комета разрывается синей сферой (пион) и шуршащими хвостами (снежные хлопья).|5 эффектов:<BR><BR>1. Зеленые звезды с пышными хвостами (кокос) и зеленое мерцание.<BR><BR>2. Фиолетовые звезды с пышными хвостами (кокос) и зеленое мерцание.<BR><BR>3. Фиолетово-желтая сфера (пион) и белое мерцание.<BR><BR>4. Красные звезды с пышными хвостами (кокос) и зеленая сфера (пион).<BR><BR>5. Комета разрывается синей сферой (пион) и шуршащими хвостами (снежные хлопья).<br><BR><iframe width="560" height="315" src="https://www.youtube.com/embed/p1w6Jg_Te5Q?rel=0" frameborder="0" allowfullscreen></iframe>||Батареи салютов У Дачи (1,25"х 19) МОНОБЛОК Р7593 ОПТОМ                                                                                                                                                                                                       |                                                                                                                                                                                                                                                              |У нас Вы можете купить Батареи салютов У Дачи (1,25"х 19) МОНОБЛОК Р7593 ОПТОМ по самым низким ценам!                                                                                                                                                         ||||1|||1|http://cx14726.tmweb.ru/images/р7593.jpg^http://cx14726.tmweb.ru/images/р7593-1.jpg^http://cx14726.tmweb.ru/images/р7593-2.jpg^http://cx14726.tmweb.ru/images/р7593-3.jpg^http://cx14726.tmweb.ru/images/р7593-4.jpg^http://cx14726.tmweb.ru/images/р7593-5.jpg|1|Количество залпов:19:1^Калибр, дюйм:1.25:2^Высота, м.:45:3^Время, сек.:30:4||new||||2|1^9|1|1|
